{
  "project": {
    "name": "ChronoVolt + MOTHER_BRAIN (MU/TH/UR Console)",
    "status": "active_locked",
    "continuity_mode": true,
    "legacy_access_code": "1047",
    "packaging_rule": "single_complete_movie_standard_package",
    "filenames_policy": "lowercase_only"
  },
  "procedural_rules": {
    "precision_critical": true,
    "triple_verification": true,
    "no_visual_guessing": true,
    "critical_accuracy": true,
    "cost_risk_flag_for_unverified": true,
    "sync_rules": [
      "manifest <-> memory_core <-> file_index always aligned",
      "all updates overwrite older definitions"
    ]
  },
  "rules_lock": [
    "only approved SVGs",
    "no deprecated IV-3A UI layouts",
    "all geometry/logic/text bind to SVG regions",
    "visual assets are non-authoritative",
    "all outputs validated and triple-checked"
  ],
  "ui_manifest_locked_sequences": {
    "page1": "red boot, CHRONOVOLT 7102, no date/location",
    "page2": "green CRT, MU/TH/UR 9001 wakingâ†’ready, date/location shown, WY logo, no 'COMPUTER READY'",
    "page3": "selector hub, green CRT, tube family grid, specs/info panels",
    "globals": {
      "date": "28 APRIL 2142",
      "location": "ZETA 2 RETICULI SYSTEM"
    }
  },
  "continuity": {
    "continuity_mode": true,
    "legacy_access_code": "1047"
  },
  "version": {
    "generated_utc": "2025-08-28T18:17:52Z",
    "source": "compact+uploads"
  }
}